{
  "id": "e2e",
  "version": "1.0.0",
  "questionnaires": [
    {
      "id": "phq9_test",
      "title": "PHQ-9 (E2E)",
      "description": "PHQ-9 test fixture for E2E tests.",
      "keywords": [
        "test",
        "e2e",
        "depression"
      ],
      "defaultOptionSetId": "frequency_4",
      "optionSets": {
        "frequency_4": [
          {
            "label": "כלל לא",
            "value": 0
          },
          {
            "label": "מספר ימים",
            "value": 1
          },
          {
            "label": "ביותר ממחצית הימים",
            "value": 2
          },
          {
            "label": "כמעט כל יום",
            "value": 3
          }
        ]
      },
      "items": [
        {
          "id": "intro",
          "type": "instructions",
          "text": "במהלך השבוע האחרון, באיזו תדירות היית מוטרד מכל אחת מן הבעיות הבאות?"
        },
        {
          "id": "1",
          "type": "select",
          "text": "עניין או הנאה מועטים מעשיית דברים"
        },
        {
          "id": "2",
          "type": "select",
          "text": "תחושת דכדוך, דיכאון, או חוסר תקווה"
        },
        {
          "id": "3",
          "type": "select",
          "text": "קשיים בהירדמות או בשינה רציפה"
        },
        {
          "id": "4",
          "type": "select",
          "text": "תחושה של עייפות או אנרגיה מועטה"
        },
        {
          "id": "5",
          "type": "select",
          "text": "תיאבון מועט או אכילת יתר"
        },
        {
          "id": "6",
          "type": "select",
          "text": "מרגיש רע לגבי עצמך"
        },
        {
          "id": "7",
          "type": "select",
          "text": "קושי להתרכז בדברים"
        },
        {
          "id": "8",
          "type": "select",
          "text": "היית מדבר או נע באיטיות"
        },
        {
          "id": "9",
          "type": "select",
          "text": "מחשבות שהיה עדיף לו היית מת"
        }
      ],
      "scoring": {
        "method": "sum"
      },
      "interpretations": {
        "target": "total",
        "ranges": [
          {
            "min": 0,
            "max": 4,
            "label": "מינימלי"
          },
          {
            "min": 5,
            "max": 9,
            "label": "קל"
          },
          {
            "min": 10,
            "max": 14,
            "label": "בינוני"
          },
          {
            "min": 15,
            "max": 19,
            "label": "בינוני-חמור"
          },
          {
            "min": 20,
            "max": 27,
            "label": "חמור"
          }
        ]
      },
      "alerts": [
        {
          "id": "suicidality",
          "condition": "item.9 >= 1",
          "message": "פריט 9 — דיווח על מחשבות אובדנ",
          "severity": "critical"
        }
      ]
    },
    {
      "id": "test_q",
      "title": "שאלון בדיקה",
      "description": "שאלון בדיקה קצר לצורכי E2E.",
      "keywords": [
        "test",
        "e2e"
      ],
      "defaultOptionSetId": "agree_4",
      "optionSets": {
        "yesno": [
          {
            "label": "כן",
            "value": 1
          },
          {
            "label": "לא",
            "value": 0
          }
        ],
        "agree_4": [
          {
            "label": "כלל לא",
            "value": 0
          },
          {
            "label": "קצת",
            "value": 1
          },
          {
            "label": "במידה רבה",
            "value": 2
          },
          {
            "label": "לגמרי",
            "value": 3
          }
        ]
      },
      "items": [
        {
          "id": "intro",
          "type": "instructions",
          "text": "ברוכים הבאים לשאלון הבדיקה."
        },
        {
          "id": "b1",
          "type": "binary",
          "text": "האם ישנת טוב הלילה?",
          "optionSetId": "yesno"
        },
        {
          "id": "b2",
          "type": "binary",
          "text": "האם הרגשת רגוע היום?",
          "optionSetId": "yesno"
        },
        {
          "id": "l1",
          "type": "select",
          "text": "הרגשתי ממוקד ופרודוקטיבי במהלך היום"
        },
        {
          "id": "l2",
          "type": "select",
          "text": "הרגשתי קשר ותמיכה מאנשים סביבי"
        }
      ],
      "scoring": {
        "method": "sum"
      }
    },
    {
      "id": "all_types_q",
      "title": "שאלון כל הסוגים (E2E)",
      "description": "Test fixture with one item of each type.",
      "keywords": [
        "test",
        "e2e",
        "all-types"
      ],
      "defaultOptionSetId": "agree_4",
      "optionSets": {
        "agree_4": [
          {
            "label": "כלל לא",
            "value": 0
          },
          {
            "label": "קצת",
            "value": 1
          },
          {
            "label": "במידה רבה",
            "value": 2
          },
          {
            "label": "לגמרי",
            "value": 3
          }
        ],
        "yesno": [
          {
            "label": "כן",
            "value": 1
          },
          {
            "label": "לא",
            "value": 0
          }
        ]
      },
      "items": [
        {
          "id": "intro",
          "type": "instructions",
          "text": "זהו שאלון בדיקה הכולל פריט אחד מכל סוג."
        },
        {
          "id": "select1",
          "type": "select",
          "text": "הרגשתי טוב היום"
        },
        {
          "id": "binary1",
          "type": "binary",
          "text": "ישנתי טוב הלילה",
          "optionSetId": "yesno"
        },
        {
          "id": "select_mood",
          "type": "select",
          "text": "כיצד היה מצב הרוח שלך היום?",
          "options": [
            {
              "label": "מצוין",
              "value": 3
            },
            {
              "label": "טוב",
              "value": 2
            },
            {
              "label": "סביר",
              "value": 1
            },
            {
              "label": "גרוע",
              "value": 0
            }
          ]
        },
        {
          "id": "slider1",
          "type": "slider",
          "text": "דרג את מצב הרוח שלך",
          "min": 0,
          "max": 10,
          "step": 1,
          "labels": {
            "min": "גרוע מאד",
            "max": "מצוין"
          }
        },
        {
          "id": "text1",
          "type": "text",
          "text": "הערות נוספות",
          "inputType": "line"
        },
        {
          "id": "multi1",
          "type": "multiselect",
          "text": "אילו תסמינים חווית השבוע?",
          "options": [
            {
              "label": "כאבי ראש"
            },
            {
              "label": "עייפות"
            },
            {
              "label": "חרדה"
            },
            {
              "label": "קשיי שינה"
            }
          ]
        }
      ],
      "scoring": {
        "method": "sum"
      }
    }
  ],
  "batteries": [
    {
      "id": "phq9_intake",
      "title": "הערכה ראשונית — דיכאון",
      "description": "סוללת PHQ-9 בלבד.",
      "keywords": [
        "depression",
        "intake"
      ],
      "sequence": [
        {
          "questionnaireId": "phq9_test"
        }
      ]
    },
    {
      "id": "standard_intake",
      "title": "שאלון בדיקה",
      "description": "סוללת בדיקה עם שאלות בינאריות וליקרט.",
      "keywords": [
        "test",
        "binary",
        "select"
      ],
      "sequence": [
        {
          "questionnaireId": "test_q"
        }
      ]
    },
    {
      "id": "all_types_battery",
      "title": "בדיקת כל הסוגים",
      "description": "Battery with one item of each type.",
      "keywords": [
        "test",
        "e2e",
        "all-types"
      ],
      "sequence": [
        {
          "questionnaireId": "all_types_q"
        }
      ]
    }
  ]
}
